parent_asin,title,rating_number,average_rating,main_category,store,price,main_image_url,image_valid,image_note,description_preview
B0B3D2KYNS,"Breville Barista Express Espresso Machine, Brushed Stainless Steel, BES870XL",21827,4.6,Amazon Home,Breville,749.95,https://m.media-amazon.com/images/I/71BvCt6eAFL._AC_SL1500_.jpg,True,OK (image/jpeg),"The barista express from bean to espresso in under a minute create great tasting espresso in less than a minute. The barista express allows you to grind the beans right before extraction, and its inte..."
B096JNWQBN,Nespresso Vertuo Coffee and Espresso Machine by De'Longhi,10622,4.7,Amazon Home,Nespresso,256.5,https://m.media-amazon.com/images/I/714Wof2GinL._AC_SL1500_.jpg,True,OK (image/jpeg),
B0BX275FX5,"De'Longhi ECP3120 15 Bar Espresso Machine with Advanced Cappuccino System, 9.6 x 7.2 x 11.9 inches, Black/Stainless Steel",8292,4.3,Amazon Home,De'Longhi,149.95,https://m.media-amazon.com/images/I/81+no1f4JyL._AC_SL1500_.jpg,True,OK (image/jpeg),"Easily make delicious espressos, lattes, cappuccinos & more right in the comfort of your kitchen with the ECP3120 by De'Longhi. The manual frother in its Advanced Cappuccino System allows you to mix s..."
B08L6GDDJM,"Nespresso Essenza Mini Original Espresso Machine by Breville,20.3 oz, Pure White",5785,4.7,Amazon Home,Breville,,https://m.media-amazon.com/images/I/61jcUGYUngL._AC_SL1500_.jpg,True,OK (image/jpeg),"Nespresso has delivered a pure and sleek compact machine yet, without compromising taste! By concentrating its Coffee know-how and expertise into a brand-new design, the new Essenza mini by Breville o..."
B003D66TXA,"Hamilton Beach 15 Bar Espresso Machine, Cappuccino, Mocha, & Latte Maker, with Milk Frother, Make 2 Cups Simultaneously, Works with Pods or Ground Coffee, 50 oz. Water Reservoir, Black",5782,4.0,Amazon Home,Hamilton Beach,99.99,https://m.media-amazon.com/images/I/719Pf52WQFL._AC_SL1500_.jpg,True,OK (image/jpeg),Cafe quality resultsno-fuss milk frother lets you enjoy cappuccino toopowerful 15-Bar Italian pump.Make sure that the Coffee grounds are not over packed in the filtersimple push-button operationeasy-f...
B07CWZ35FG,Urnex Espresso Machine Cleaning Powder - 566 grams - Cafiza Professional Espresso Machine Cleaner,5719,4.8,Amazon Home,Urnex,13.35,https://m.media-amazon.com/images/I/51Wt9c9QkkL._AC_SL1000_.jpg,True,OK (image/jpeg),"Cafiza Espresso Machine Cleaner Powder is an integral part of the daily maintenance routine for espresso machines. Specifically formulated for effective use in the back flush cleaning process, Cafiza ..."
